{
  "ambiguities": [],
  "artifact_kind": "interpretation",
  "assumptions": [],
  "clauses": [
    {
      "disposition": "obligations",
      "end_byte": 599,
      "refs": [
        "D1",
        "O1",
        "O2",
        "S1"
      ],
      "start_byte": 0
    }
  ],
  "request": {
    "byte_length": 599,
    "document_hash": "sha256:9e6b269100ced6be9a2221e604627ecdf669e35ce2a39b0a85f0953ae4a44f37",
    "document_ref": "request.txt"
  },
  "schema_version": "0.1",
  "selected_defaults": []
}
